[
  {
    "schemaVersion": 1,
    "id": "pmicbook",
    "slug": "pmicbook",
    "title": {
      "en": "PMICBook",
      "ko": "PMICBook"
    },
    "subtitle": {
      "en": "Power Management IC Technology",
      "ko": "전력관리 IC 기술"
    },
    "description": {
      "en": "An interactive engineering textbook that connects PMIC systems and specifications to circuits, semiconductor devices, BCD technology, fabrication and integration, layout, characterization, reliability, and failure analysis.",
      "ko": "전력 관리 시스템과 사양에서 시작해 PMIC 회로 아키텍처, 반도체 소자와 BCD 기술, 제조 및 공정 통합, 레이아웃과 기생 효과, 열 특성, 특성 평가와 시험, 신뢰성 및 고장 분석까지 연결하는 인터랙티브 공학 교재입니다."
    },
    "category": "semiconductor",
    "tags": [
      "power management",
      "PMIC",
      "BCD",
      "power devices",
      "fabrication",
      "characterization",
      "reliability",
      "failure analysis"
    ],
    "status": "published",
    "repositoryUrl": "https://github.com/frbread7/pmicbook",
    "productionUrl": "https://frbread7.github.io/pmicbook/",
    "languages": [
      "en",
      "ko"
    ],
    "version": "1.1.0",
    "lastUpdated": "2026-10-09",
    "chapterCount": 25,
    "chapters": [
      {
        "id": "overview",
        "number": 1,
        "title": {
          "en": "PMIC Systems and Power Domains",
          "ko": "PMIC 시스템과 전원 도메인"
        },
        "urls": {
          "en": "https://frbread7.github.io/pmicbook/chapters/overview.html",
          "ko": "https://frbread7.github.io/pmicbook/ko/chapters/overview.html"
        },
        "topics": [
          "systems",
          "power rails"
        ]
      },
      {
        "id": "fundamentals",
        "number": 2,
        "title": {
          "en": "PMIC Specifications and Fundamentals",
          "ko": "PMIC 사양과 기초"
        },
        "urls": {
          "en": "https://frbread7.github.io/pmicbook/chapters/fundamentals.html",
          "ko": "https://frbread7.github.io/pmicbook/ko/chapters/fundamentals.html"
        },
        "topics": [
          "specifications",
          "efficiency",
          "transients"
        ]
      },
      {
        "id": "references-ldo",
        "number": 3,
        "title": {
          "en": "References, Bias, and LDOs",
          "ko": "기준전압, 바이어스 및 LDO"
        },
        "urls": {
          "en": "https://frbread7.github.io/pmicbook/chapters/references-ldo.html",
          "ko": "https://frbread7.github.io/pmicbook/ko/chapters/references-ldo.html"
        },
        "topics": [
          "references",
          "LDO",
          "feedback"
        ]
      },
      {
        "id": "switching",
        "number": 4,
        "title": {
          "en": "Switching and Power-Path Circuits",
          "ko": "스위칭 및 전원 경로 회로"
        },
        "urls": {
          "en": "https://frbread7.github.io/pmicbook/chapters/switching.html",
          "ko": "https://frbread7.github.io/pmicbook/ko/chapters/switching.html"
        },
        "topics": [
          "buck",
          "boost",
          "power path"
        ]
      },
      {
        "id": "devices",
        "number": 5,
        "title": {
          "en": "Semiconductor Devices for PMICs",
          "ko": "PMIC용 반도체 소자"
        },
        "urls": {
          "en": "https://frbread7.github.io/pmicbook/chapters/devices.html",
          "ko": "https://frbread7.github.io/pmicbook/ko/chapters/devices.html"
        },
        "topics": [
          "semiconductor devices",
          "MOSFET",
          "BJT"
        ]
      },
      {
        "id": "bcd",
        "number": 6,
        "title": {
          "en": "BCD Technology Architecture",
          "ko": "BCD 기술 아키텍처"
        },
        "urls": {
          "en": "https://frbread7.github.io/pmicbook/chapters/bcd.html",
          "ko": "https://frbread7.github.io/pmicbook/ko/chapters/bcd.html"
        },
        "topics": [
          "BCD",
          "isolation",
          "integration"
        ]
      },
      {
        "id": "hv-devices",
        "number": 7,
        "title": {
          "en": "High-Voltage MOS and LDMOS",
          "ko": "고전압 MOS 및 LDMOS"
        },
        "urls": {
          "en": "https://frbread7.github.io/pmicbook/chapters/hv-devices.html",
          "ko": "https://frbread7.github.io/pmicbook/ko/chapters/hv-devices.html"
        },
        "topics": [
          "LDMOS",
          "drift region",
          "breakdown"
        ]
      },
      {
        "id": "passives",
        "number": 8,
        "title": {
          "en": "Integrated Passive Devices",
          "ko": "집적 수동소자"
        },
        "urls": {
          "en": "https://frbread7.github.io/pmicbook/chapters/passives.html",
          "ko": "https://frbread7.github.io/pmicbook/ko/chapters/passives.html"
        },
        "topics": [
          "resistors",
          "capacitors",
          "parasitics"
        ]
      },
      {
        "id": "wafer",
        "number": 9,
        "title": {
          "en": "Starting Substrate, Wells, and Isolation",
          "ko": "기판, 웰 및 절연"
        },
        "urls": {
          "en": "https://frbread7.github.io/pmicbook/chapters/wafer.html",
          "ko": "https://frbread7.github.io/pmicbook/ko/chapters/wafer.html"
        },
        "topics": [
          "substrate",
          "wells",
          "isolation"
        ]
      },
      {
        "id": "oxidation",
        "number": 10,
        "title": {
          "en": "Gate Dielectrics and Field Structures",
          "ko": "게이트 절연막 및 전계 구조"
        },
        "urls": {
          "en": "https://frbread7.github.io/pmicbook/chapters/oxidation.html",
          "ko": "https://frbread7.github.io/pmicbook/ko/chapters/oxidation.html"
        },
        "topics": [
          "dielectrics",
          "field plates",
          "thermal budget"
        ]
      },
      {
        "id": "litho",
        "number": 11,
        "title": {
          "en": "Lithography and Resist Patterning",
          "ko": "리소그래피와 포토레지스트 패터닝"
        },
        "urls": {
          "en": "https://frbread7.github.io/pmicbook/chapters/litho.html",
          "ko": "https://frbread7.github.io/pmicbook/ko/chapters/litho.html"
        },
        "topics": [
          "lithography",
          "resist",
          "patterning"
        ]
      },
      {
        "id": "etch",
        "number": 12,
        "title": {
          "en": "Etch, Isolation, and Contacts",
          "ko": "식각, 절연 및 콘택트"
        },
        "urls": {
          "en": "https://frbread7.github.io/pmicbook/chapters/etch.html",
          "ko": "https://frbread7.github.io/pmicbook/ko/chapters/etch.html"
        },
        "topics": [
          "etch",
          "contacts",
          "selectivity"
        ]
      },
      {
        "id": "deposition",
        "number": 13,
        "title": {
          "en": "Deposition and Epitaxy",
          "ko": "박막 증착과 에피택시"
        },
        "urls": {
          "en": "https://frbread7.github.io/pmicbook/chapters/deposition.html",
          "ko": "https://frbread7.github.io/pmicbook/ko/chapters/deposition.html"
        },
        "topics": [
          "CVD",
          "ALD",
          "epitaxy"
        ]
      },
      {
        "id": "implant",
        "number": 14,
        "title": {
          "en": "Doping and Well/Drift Implants",
          "ko": "웰·드리프트 도핑과 이온 주입"
        },
        "urls": {
          "en": "https://frbread7.github.io/pmicbook/chapters/implant.html",
          "ko": "https://frbread7.github.io/pmicbook/ko/chapters/implant.html"
        },
        "topics": [
          "implant",
          "doping",
          "junctions"
        ]
      },
      {
        "id": "anneal",
        "number": 15,
        "title": {
          "en": "Anneal and Thermal Budget",
          "ko": "어닐링과 열 예산"
        },
        "urls": {
          "en": "https://frbread7.github.io/pmicbook/chapters/anneal.html",
          "ko": "https://frbread7.github.io/pmicbook/ko/chapters/anneal.html"
        },
        "topics": [
          "anneal",
          "diffusion",
          "activation"
        ]
      },
      {
        "id": "cmp",
        "number": 16,
        "title": {
          "en": "Planarization and CMP",
          "ko": "평탄화와 CMP"
        },
        "urls": {
          "en": "https://frbread7.github.io/pmicbook/chapters/cmp.html",
          "ko": "https://frbread7.github.io/pmicbook/ko/chapters/cmp.html"
        },
        "topics": [
          "CMP",
          "planarization",
          "topography"
        ]
      },
      {
        "id": "metal",
        "number": 17,
        "title": {
          "en": "Contacts, BEOL, and Thick Top Metal",
          "ko": "콘택트, BEOL 및 두꺼운 최상층 금속"
        },
        "urls": {
          "en": "https://frbread7.github.io/pmicbook/chapters/metal.html",
          "ko": "https://frbread7.github.io/pmicbook/ko/chapters/metal.html"
        },
        "topics": [
          "BEOL",
          "IR drop",
          "electromigration"
        ]
      },
      {
        "id": "integration",
        "number": 18,
        "title": {
          "en": "BCD Process Integration Flow",
          "ko": "BCD 공정 통합 흐름"
        },
        "urls": {
          "en": "https://frbread7.github.io/pmicbook/chapters/integration.html",
          "ko": "https://frbread7.github.io/pmicbook/ko/chapters/integration.html"
        },
        "topics": [
          "process integration",
          "BCD",
          "CMOS"
        ]
      },
      {
        "id": "layout",
        "number": 19,
        "title": {
          "en": "Layout, Parasitics, Thermal, and Noise",
          "ko": "레이아웃, 기생 성분, 열 및 노이즈"
        },
        "urls": {
          "en": "https://frbread7.github.io/pmicbook/chapters/layout.html",
          "ko": "https://frbread7.github.io/pmicbook/ko/chapters/layout.html"
        },
        "topics": [
          "layout",
          "parasitics",
          "thermal"
        ]
      },
      {
        "id": "metrology",
        "number": 20,
        "title": {
          "en": "Characterization and Production Test",